NBC,Saudi Arabia says U.S. asked it to postpone oil supply cut by a month,https://www.nbcnews.com/news/world/saudi-arabia-says-biden-admin-asked-postpone-oil-supply-cut-month-rcna52037,10-14-22
NBC,American POWs in Ukraine 'prayed for death' fearing they'd never come home,https://www.nbcnews.com/news/us-news/american-pows-fighting-ukraine-prayed-death-fearing-never-come-home-rcna52071,10-14-22
NBC,Rare protest criticizes China's president days before Communist Party congress,https://www.nbcnews.com/news/world/china-xi-jinping-protest-beijing-communist-party-congress-zero-covid-rcna52043,10-14-22
NBC,Biden warns there will be 'consequences' for Saudi Arabia after oil production cut,https://www.nbcnews.com/politics/joe-biden/biden-warns-will-consequences-saudi-arabia-oil-production-cut-rcna51804,10-14-22
NBC,Why gas prices are going back up after nearly 100 days of declines,https://www.nbcnews.com/business/consumer/higher-gas-prices-why-and-where-costco-gas-prices-rcna51458,10-14-22
NBC,Putin appointed 'General Armageddon' and hit civilian targets. Is he shifting tactics in Ukraine?,https://www.nbcnews.com/news/world/russia-ukraine-war-putin-strikes-crimea-bridge-explosion-strikes-rcna51612,10-14-22
NBC,Russia's intel agency arrests 8 people and blames Ukraine for Crimea bridge blast,https://www.nbcnews.com/news/world/russia-fsb-arrests-blames-ukraine-crimea-bridge-blast-rcna51820,10-14-22
CNN,Reclaim the runway: $8 billion project to transform shuttered Berlin airport into an eco city ,https://edition.cnn.com/travel/article/berlin-txl-tegel-airport-redevelopment-spc-intl/index.html,10-14-22
CNN,This company is making whirlpools to clean microplastics from water,https://edition.cnn.com/2022/10/03/europe/wasser-microplastics-germany-spc-intl-scn/index.html,10-14-22
CNN,World's tallest building could be surrounded by a giant ring,https://edition.cnn.com/style/article/dubai-downtown-circle-znera-space-design-spc-intl/index.html,10-14-22
CNN,The man-made islands emerging from the sea,https://edition.cnn.com/travel/article/dubai-heart-of-europe-nears-completion/index.html,10-14-22
CNN,This Martian city is being built in the desert outside Dubai,https://edition.cnn.com/style/article/mars-science-city-design-spc-scn/index.html,10-14-22
CNN,How Naomi Campbell surprised this Nigerian designer on the runway,https://edition.cnn.com/style/article/naomi-campbell-ian-audifferen-nigeria-arise-fashion-hnk-spc-intl/index.html,10-14-22
CNN,South African artist blurs dreams and reality ,https://edition.cnn.com/style/article/xopher-wallace-anonymous-artist-south-africa-spc-intl/index.html,10-14-22
CNN,"Sharks and seals, photographed up close",https://edition.cnn.com/travel/gallery/steve-benjamin-underwater-photography-cape-town-spc-intl/index.html,10-14-22
CNN,ESPN report finds new allegations on Commanders' Dan Snyder,https://bleacherreport.com/articles/10052243-espn-commanders-daniel-snyder-says-nfl-is-a-mafia-and-they-cant-f--k-with-me?utm_source=cnn.com&utm_medium=referral&utm_campaign=editorial,10-14-22
CNN,Two fisherman indicted in cheating scandal,https://bleacherreport.com/articles/10052205-jacob-runyan-chase-cominski-indicted-after-allegedly-cheating-in-fishing-tournament?utm_source=cnn.com&utm_medium=referral&utm_campaign=editorial,10-14-22
CNN,NFL star charged after pushing stadium worker,https://bleacherreport.com/articles/10052165-raiders-davante-adams-charged-with-misdemeanor-assault-after-pushing-photographer?utm_source=cnn.com&utm_medium=referral&utm_campaign=editorial,10-14-22
CNN,Bodybuilder charged with murdering ex-wife,https://bleacherreport.com/articles/10052156-bodybuilder-ian-baunach-arraigned-on-murder-charges-for-ex-wife-katies-death?utm_source=cnn.com&utm_medium=referral&utm_campaign=editorial,10-14-22
CNN,"Brady, Clijsters latest athletes to invest in pickleball",https://bleacherreport.com/articles/10052136-tom-brady-kim-clijsters-to-purchase-major-league-pickleball-expansion-team?utm_source=cnn.com&utm_medium=referral&utm_campaign=editorial,10-14-22
CNN,Ex-Angels staffer sentenced to 22-years in prison ,https://bleacherreport.com/articles/10052098-former-angels-staffer-eric-kay-given-22-year-jail-sentence-in-tyler-skaggs-case?utm_source=cnn.com&utm_medium=referral&utm_campaign=editorial,10-14-22
CNN,0% intro APR until 2024 is 100% insane,https://www.fool.com/the-ascent/credit-cards/landing/wells-fargo-reflect-review/?utm_site=theascent&utm_campaign=ta-cc-co-cnn-welref2-ron-5-hp-sfpb&utm_medium=cpc&utm_source=cnn,10-14-22
CNN,It's official: now avoid credit card interest into 2024,https://www.fool.com/the-ascent/credit-cards/landing/citi-simplicity-review/?utm_site=theascent&utm_campaign=ta-cc-co-cnn-citisimp2-ron-5-hp-sfpb&utm_medium=cpc&utm_source=cnn,10-14-22
CNN,Experts: this is the best cash back card of 2022,https://www.fool.com/the-ascent/credit-cards/landing/wells-fargo-active-cash-card-review/?utm_site=theascent&utm_campaign=ta-cc-co-cnn-welac2-ron-5-hp-sfpb&utm_medium=cpc&utm_source=cnn,10-14-22
CNN,Home Prices are Falling - Don't Wait to Tap Into Your Home's Equity,https://www.lendingtree.com/?splitterid=home-equity&cproduct=he&cchannel=content&csource=cnn&cmethod=heform&ccreative=fallingdontwait_flagcoins&placement_name=sectionfronts&ad_headline=fallingdontwait&ad_image_name=flagcoins&ctype=sectionfronts&bdst=revshare&mtaid=AC53E&esourceid=6348616,10-14-22
CNN,Home Prices Drop Most Since 2011 - Get Cash Out of Your Home ASAP,https://www.lendingtree.com/?splitterid=home-equity&cproduct=he&cchannel=content&csource=cnn&cmethod=heform&ccreative=dropgetcash_flagcoins&placement_name=sectionfronts&ad_headline=dropgetcash&ad_image_name=flagcoins&ctype=sectionfronts&bdst=revshare&mtaid=AC53E&esourceid=6348616,10-14-22
CNN,Experts Urge Americans to Refi Before the Next Fed Meeting,https://www.lendingtree.com/?splitterid=content-mortgage&loan-type=refinance&cchannel=content&cname=cnn&cmethod=refiform&cproduct=refi&ccreative=expertsurgerefifed_flagcoins&placement_name=sectionfronts&ad_headline=expertsurgerefifed&ad_image_name=flagcoins&ctype=sectionfronts&bdst=revshare&mtaid=060C8&esourceid=6338766,10-14-22
